,Name,Category,Year,Profession,Place,Gender,Birthdate,Age,Description,Link,Country
373,Jared Cohen,PIONEERS,2013,American businessman,"Weston, CT",Male,1981-11-24,39,"Jared Andrew Cohen is an American businessman currently serving as the CEO of Jigsaw and an Adjunct Senior Fellow at the Council on Foreign Relations. Previously, he served as a member of the Secretary of State's Policy Planning Staff and as an advisor to Condoleezza Rice and later Hillary Clinton. ",content.time.comhttps://time100.time.com/2013/04/18/time-100/slide/jared-cohen/,USA
374,Moncef Marzouki,PIONEERS,2013,Former Interim President of Tunisia,"Grombalia, Tunisia",Male,1945-07-07,75,"Mohamed Moncef Marzouki is a Tunisian politician who was President of Tunisia from 2011 to 2014. Through his career he has been a human rights activist, physician and politician. On 12 December 2011, he was elected as President of Tunisia by the Constituent Assembly. ",content.time.comhttps://time100.time.com/2013/04/18/time-100/slide/moncef-marzouki/,Tunisia
375,Christopher Fabian and Erica Kochi,PIONEERS,2013,Null,,Unknown,,0,Null,content.time.comhttps://time100.time.com/2013/04/18/time-100/slide/christopher-fabian-and-erica-kochi/,Null
376,Kimberly Blackwell,PIONEERS,2013,Null,,Female,,0,Null,content.time.comhttps://time100.time.com/2013/04/18/time-100/slide/kimberly-blackwell/,Null
377,Kai-Fu Lee,PIONEERS,2013,American-Taiwanese computer scientist,Taiwan,Male,1961-12-03,59,"Kai-Fu Lee is a Taiwanese-born American computer scientist, businessman, and writer. He is currently based in Beijing, China. Lee developed a speaker-independent, continuous speech recognition system as his Ph.D. thesis at Carnegie Mellon. ",content.time.comhttps://time100.time.com/2013/04/18/time-100/slide/kai-fu-lee/,Null
378,Mary Nichols,PIONEERS,2013,American attorney,"Minneapolis, MN",Female,1945-04-10,75,Mary Dolores Nichols is an American attorney and government official who has been the chairwoman of the California Air Resources Board since 2007. She also held that post between 1979 and 1983. ,content.time.comhttps://time100.time.com/2013/04/18/time-100/slide/mary-nichols/,USA
379,Peter Theisinger and Richard Cook,PIONEERS,2013,Null,,Male,,0,Null,content.time.comhttps://time100.time.com/2013/04/18/time-100/slide/peter-theisinger-and-richard-cook/,Null
380,Malala Yousafzai,ICONS,2013,Pakistani activist,"Mingora, Pakistan",Female,1997-07-12,23,"Malala Yousafzai, often referred to mononymously as Malala, is a Pakistani activist for female education and the youngest Nobel Prize laureate. ",content.time.comhttps://time100.time.com/2013/04/18/time-100/slide/malala-yousafzai/,Pakistan
381,Lena Dunham,ICONS,2013,American actress,"New York, NY",Female,1986-05-13,34,"Lena Dunham is an American actress, writer, director, and producer. She is known as the creator, writer, and star of the HBO television series Girls, for which she received several Emmy Award nominations and two Golden Globe Awards. ",content.time.comhttps://time100.time.com/2013/04/18/time-100/slide/lena-dunham/,USA
382,Mario Balotelli,ICONS,2013,Italian soccer player,"Palermo, Italy",Male,1990-08-12,30,Mario Balotelli Barwuah is an Italian professional footballer who plays as a striker for Serie B club Monza and the Italy national team. ,content.time.comhttps://time100.time.com/2013/04/18/time-100/slide/mario-balotelli/,Italy
383,Peng Liyuan,ICONS,2013,Chinese singer,"Yuncheng County, Heze, China",Unknown,1962-11-20,58,"Peng Liyuan is a Chinese contemporary folk singer who is the spouse of the President of the People's Republic of China. Peng Liyuan is married to the current General Secretary of the Chinese Communist Party and President Xi Jinping. Peng is referred to as the ""Chinese First Lady"" by Chinese media. ",content.time.comhttps://time100.time.com/2013/04/18/time-100/slide/peng-liyuan/,China
384,Aung San Suu Kyi,ICONS,2013,State Counsellor of Myanmar,"Yangon, Myanmar (Burma)",Female,1945-06-19,75,"Aung San Suu Kyi is a Burmese politician, diplomat, author, and a 1991 Nobel Peace Prize laureate. The first and incumbent State Counsellor of Myanmar, she is also the leader of the National League for Democracy and played a vital role in the state's transition from military junta to partial democracy. ",content.time.comhttps://time100.time.com/2013/04/18/time-100/slide/aung-san-suu-kyi/,Myanmar (Burma)
385,Omotola Jalade-Ekeinde,ICONS,2013,Nigerian actress,"Lagos, Nigeria",Female,1978-02-07,42,"Omotola Jalade Ekeinde MFR is a Nigerian actress, singer, philanthropist and former model. Since her Nollywood film debut in 1995, Omotola has appeared in over 300 films, selling millions of video copies. ",content.time.comhttps://time100.time.com/2013/04/18/time-100/slide/omotola-jalade-ekeinde/,Nigeria
386,Lindsey Vonn,ICONS,2013,American alpine ski racer,"Saint Paul, MN",Female,1984-10-18,36,"Lindsey Caroline Vonn is an American former World Cup alpine ski racer on the US Ski Team. She won four World Cup overall championships—one of only two female skiers to do so, along with Annemarie Moser-Pröll—with three consecutive titles in 2008, 2009, and 2010, plus another in 2012. ",content.time.comhttps://time100.time.com/2013/04/18/time-100/slide/lindsey-vonn/,USA
387,Justin Timberlake,ICONS,2013,American singer-songwriter,"Memphis, TN",Male,1981-01-31,39,"Justin Randall Timberlake is an American singer, songwriter, actor, and record producer. Born and raised in Tennessee, he appeared on the television shows Star Search and The All-New Mickey Mouse Club as a child. ",content.time.comhttps://time100.time.com/2013/04/18/time-100/slide/justin-timberlake/,USA
388,Gabrielle Giffords,ICONS,2013,Former United States Representative,"Tucson, AZ",Female,1970-06-08,50,"Gabrielle Dee Giffords is an American politician and gun control advocate who served as a member of the United States House of Representatives representing Arizona's 8th congressional district from January 2007 until January 2012, when she resigned due to a severe brain injury suffered during an assassination attempt. ",content.time.comhttps://time100.time.com/2013/04/18/time-100/slide/gabrielle-giffords/,USA
389,Beyoncé,ICONS,2013,American singer,"Houston, TX",Female,1981-09-04,39,"Beyoncé Giselle Knowles-Carter is an American singer, actress and record producer. Born and raised in Houston, Texas, Beyoncé performed in various singing and dancing competitions as a child. She rose to fame in the late 1990s as the lead singer of Destiny's Child, one of the best-selling girl groups of all time. ",content.time.comhttps://time100.time.com/2013/04/18/time-100/slide/beyonce/,USA
390,Daniel Day-Lewis,ICONS,2013,Actor,Kensington,Male,1957-04-29,63,"Sir Daniel Michael Blake Day-Lewis is a retired English actor with dual British and Irish citizenship. One of the most respected actors of his generation, he has also been hailed as one of the greatest actors in cinematic history. ",content.time.comhttps://time100.time.com/2013/04/18/time-100/slide/daniel-day-lewis/,Null
391,Kate Middleton,ICONS,2013,Null,"Cambridge, United Kingdom",Female,,0,"Catherine, Duchess of Cambridge, GCVO, is a member of the British royal family. Her husband, Prince William, Duke of Cambridge, is second in the line of succession to the British throne, making Catherine a likely future queen consort. ",content.time.comhttps://time100.time.com/2013/04/18/time-100/slide/kate-middleton/,United Kingdom
392,Michelle Obama,ICONS,2013,Former First Lady of the United States,"Chicago, IL",Female,1964-01-17,56,"Michelle LaVaughn Robinson Obama is an American attorney and author who was the First Lady of the United States from 2009 to 2017. She is married to the 44th president of the United States, Barack Obama, and was the first African-American First Lady. ",content.time.comhttps://time100.time.com/2013/04/18/time-100/slide/michelle-obama/,USA
393,Li Na,ICONS,2013,Chinese tennis player,"Wuhan, China",Female,1982-02-26,38,"Li Na is a retired Chinese tennis player. She achieved a career-high WTA ranking of world No. 2 on 17 February 2014. Over the course of her career, Li won nine WTA Tour singles titles including two Grand Slam singles titles at the 2011 French Open and 2014 Australian Open. ",content.time.comhttps://time100.time.com/2013/04/18/time-100/slide/li-na/,China
394,Kanye West,TITANS,2015,American rapper,"Atlanta, GA",Male,1977-06-08,43,"Kanye Omari West is an American rapper, record producer, and fashion designer. He has been influential in the 21st-century development of mainstream hip hop and popular music in general. ",https://time.com/collection-post/3822841/kanye-west-2015-time-100/,USA
395,Lorne Michaels,TITANS,2015,American-Canadian television producer,"Toronto, Canada",Unknown,1944-11-17,76,"Lorne Michaels CC is a Canadian-American television producer and screenwriter best known for creating and producing Saturday Night Live and producing the Late Night series, The Kids in the Hall and The Tonight Show. ",https://time.com/collection-post/3822845/lorne-michaels-2015-time-100/,Canada
396,Mellody Hobson,TITANS,2015,American businesswoman,"Chicago, IL",Female,1969-04-03,51,"Mellody Hobson is an American businesswoman who is the president and co-CEO of Ariel Investments. She is the former chairwoman of DreamWorks Animation, having stepped down after negotiating the acquisition of DreamWorks Animation SKG, Inc., by NBCUniversal in August, 2016. ",https://time.com/collection-post/3822587/mellody-hobson-2015-time-100/,USA
397,Tim Cook,TITANS,2015,Chief Executive Officer of Apple,"Mobile, AL",Male,1960-11-01,60,"Timothy Donald Cook is an American business executive, philanthropist and engineer. Cook is the chief executive officer of Apple Inc., and previously served as the company's chief operating officer under its cofounder Steve Jobs. ",https://time.com/collection-post/3822599/tim-cook-2015-time-100/,USA
398,Elizabeth Holmes,TITANS,2015,American businesswoman,"Washington, D.C.",Female,1984-02-03,36,"Elizabeth Anne Holmes is an American businesswoman who founded and was the CEO of Theranos, a now-defunct health technology company. ",https://time.com/collection-post/3822734/elizabeth-holmes-2015-time-100/,D.C.
399,Charles Koch,TITANS,2015,Chief Executive Officer of Koch Industries,"Wichita, KS",Male,1935-11-01,85,"Charles de Ganahl Koch is an American businessman and philanthropist. As of March 2019, he was ranked as the 11th-richest person in the world, with an estimated net worth of $50.5 billion. ",https://time.com/collection-post/3822767/charles-koch-david-koch-2015-time-100/,USA
400,Susan Wojcicki,TITANS,2015,CEO of YouTube,"Santa Clara County, CA",Female,1968-07-05,52,"Susan Diane Wojcicki is the CEO of YouTube. She is the longest tenured CEO in the history of YouTube. Wojcicki was involved in the founding of Google, and became Google's first marketing manager in 1999. She later led the company's online advertising business and was put in charge of Google's original video service. ",https://time.com/collection-post/3822770/susan-wojcicki-2015-time-100/,USA
401,Chanda Kochhar,TITANS,2015,Executive,"Jodhpur, India",Female,1961-11-17,59,"Chanda Kochhar was the managing director and chief executive officer of ICICI Bank. However, on 4 October 2018 she stepped down from her position following allegations of corruption. Amidst investigations related to Videocon bad loans, she was forced by the board of ICICI Bank to take indefinite leave. ",https://time.com/collection-post/3822610/chanda-kochhar-2015-time-100/,India
402,Tony Fernandes,TITANS,2015,Entrepreneur,"Kuala Lumpur, Malaysia",Male,1964-04-30,56,"Anthony Francis Fernandes PSM, CBE is a Malaysian entrepreneur. He is the founder of Tune Air Sdn. Bhd., who introduced the first budget no-frills airline, AirAsia, to Malaysians with the tagline ""Now everyone can fly"". ",https://time.com/collection-post/3822614/tony-fernandes-2015-time-100/,Malaysia
403,Lee Daniels,TITANS,2015,American film writer,"Philadelphia, PA",Unknown,1959-12-24,60,"Lee Daniels is an American film and television writer, director, and producer. Daniels produced 2001’s Academy Award winning Monster's Ball. ",https://time.com/collection-post/3822623/lee-daniels-2015-time-100/,USA
404,Reid Hoffman,TITANS,2015,American entrepreneur,"Palo Alto, CA",Male,1967-08-05,53,"Reid Garrett Hoffman is an American internet entrepreneur, venture capitalist and author. Hoffman was the co-founder and executive chairman of LinkedIn, a business-oriented social network used primarily for professional networking. He is currently a partner at the venture capital firm Greylock Partners. ",https://time.com/collection-post/3822665/reid-hoffman-2015-time-100/,USA
405,Kim Kardashian West,TITANS,2015,American socialite,"Los Angeles, CA",Female,1980-10-21,40,"Kimberly Noel Kardashian West is an American media personality, socialite, model, businesswoman, producer, and actress. ",https://time.com/collection-post/3822676/kim-kardashian-west-2015-time-100/,USA
406,Janet Yellen,TITANS,2015,Former Chair of the Federal Reserve,"Brooklyn, New York, NY",Female,1946-08-13,74,"Janet Louise Yellen is an American economist who is currently a distinguished fellow at the Brookings Institution and a professor emeritus at Haas School of Business at the University of California, Berkeley. ",https://time.com/collection-post/3822773/janet-yellen-2015-time-100/,USA
407,Danny Meyer,TITANS,2015,Restaurateur,"St. Louis, MO",Unknown,1958-03-14,62,Daniel Meyer is a New York City restaurateur and the Chief Executive Officer of the Union Square Hospitality Group. ,https://time.com/collection-post/3822803/danny-meyer-2015-time-100/,USA
408,Lei Jun,TITANS,2015,Chinese entrepreneur,"Xiantao, China",Unknown,1969-12-16,50,"Lei Jun is a Chinese billionaire entrepreneur, investor and philanthropist who co-founded Xiaomi, one of the largest smartphone and consumer electronics companies in the world that in June 2018 raised US$4.72 billion after its listing at the Hong Kong Stock Exchange. ",https://time.com/collection-post/3822814/lei-jun-2015-time-100/,China
409,Bob Iger,TITANS,2015,Chairman of Disney,"New York, NY",Male,1951-02-10,69,"Robert Allen Iger is an American business executive who is Executive Chairman of The Walt Disney Company. Before working for Disney, Bob served as the President of ABC Television from 1994 to 1995, and as President/COO of Capital Cities/ABC, Inc. from 1995 until Disney's acquisition of the company in 1996. ",https://time.com/collection-post/3822742/bob-iger-2015-time-100/,USA
410,Satya Nadella,TITANS,2015,Chief Executive Officer of Microsoft,"Hyderabad, India",Male,1967-08-19,53,"Satya Narayana Nadella is an Indian-American business executive. He is the chief executive officer of Microsoft, succeeding Steve Ballmer in 2014. Before becoming CEO, he was the executive vice president of Microsoft's cloud and enterprise group, responsible for building and running the company's computing platforms. ",https://time.com/collection-post/3822749/satya-nadella-2015-time-100/,India
411,Jorge Paulo Lemann,TITANS,2015,Banker,"Rio de Janeiro, Brazil",Unknown,1939-08-26,81,"Jorge Paulo Lemann is a Brazilian billionaire investment banker, and businessman with dual Brazilian and Swiss citizenship. As of October 2019, Lemann was ranked 37th richest in the world by Forbes, with an estimated net worth of US$24.6 billion. ",https://time.com/collection-post/3822760/jorge-paulo-lemann-2015-time-100/,Brazil
412,Misty Copeland,TITANS,2015,American ballet dancer,"Kansas City, MO",Female,1982-09-10,38,"Misty Danielle Copeland is an American ballet dancer for American Ballet Theatre, one of the three leading classical ballet companies in the United States. On June 30, 2015, Copeland became the first African American woman to be promoted to principal dancer in ABT's 75-year history. ",https://time.com/collection-post/3823308/misty-copeland-2015-time-100/,USA
413,Scott Kelly,PIONEERS,2015,American astronaut,"City of Orange, NJ",Male,1964-02-21,56,"Scott Joseph Kelly is an American engineer, retired astronaut, and naval aviator. A veteran of four space flights, Kelly commanded the International Space Station on Expeditions 26, 45, and 46. Kelly's first spaceflight was as pilot of Space Shuttle Discovery during STS-103 in December 1999. ",https://time.com/collection-post/3823314/scott-kelly-2015-time-100/,USA
414,Emmanuelle Charpentier,PIONEERS,2015,French professor,"Juvisy-sur-Orge, France",Female,1968-12-11,51,"Emmanuelle Marie Charpentier is a French professor and researcher in microbiology, genetics and biochemistry. Since 2015, she has been a Director at the Max Planck Institute for Infection Biology in Berlin. In 2018, she founded an independent research institute, the Max Planck Unit for the Science of Pathogens. ",https://time.com/collection-post/3822554/emmanuelle-charpentier-jennifer-doudna-2015-time-100/,France
415,Brian Chesky,PIONEERS,2015,"CEO of Airbnb, Inc.","Niskayuna, NY",Male,1981-08-29,39,"Brian Joseph Chesky is an American businessman and industrial designer. He is the co-founder and CEO of the peer-to-peer lodging service Airbnb. Chesky was named one of Time's ""100 Most Influential People of 2015"". ",https://time.com/collection-post/3822568/brian-chesky-2015-time-100/,USA
416,Jimmy Lai,PIONEERS,2015,Entrepreneur,"Guangzhou, China",Male,1948-12-08,71,"Lai Chee-Ying, also known as Jimmy Lai, is a Hong Kong entrepreneur and social activist. He founded Giordano, an Asian clothing retailer, Next Digital, a Hong Kong-listed media company, and the popular newspaper Apple Daily. ",https://time.com/collection-post/3823046/jimmy-lai-2015-time-100/,China
417,Emma Watson,PIONEERS,2015,Actress,"Paris, France",Female,1990-04-15,30,"Emma Charlotte Duerre Watson is an English actress, model, and activist. Born in Paris and raised in Oxfordshire, Watson attended the Dragon School and trained as an actress at the Oxford branch of Stagecoach Theatre Arts. ",https://time.com/collection-post/3823057/emma-watson-2015-time-100/,France
418,Vikram Patel,PIONEERS,2015,Indian psychiatrist,"Mumbai, India",Male,1964-05-05,56,Vikram Harshad Patel FMedSci is an Indian psychiatrist and researcher best known for his work on child development and mental disability in low-resource settings. ,https://time.com/collection-post/3822953/vikram-patel-2015-time-100/,India
419,Pardis Sabeti,PIONEERS,2015,American-Iranian computational biologist,"Tehran, Iran",Unknown,1975-12-25,44,"Pardis Christine Sabeti is an Iranian-American computational biologist, medical geneticist and evolutionary geneticist. ",https://time.com/collection-post/3822958/pardis-sabeti-2015-time-100/,Iran
420,Reese Witherspoon,PIONEERS,2015,American actress,"New Orleans, LA",Female,1976-03-22,44,"Laura Jeanne Reese Witherspoon is an American actress, producer, and entrepreneur. The recipient of various accolades, including an Academy Award, two Golden Globe Awards, and a Primetime Emmy Award, she is one of the highest-paid actresses in the world as of 2019. ",https://time.com/collection-post/3822959/reese-witherspoon-2015-time-100/,USA
421,Bryan Stevenson,PIONEERS,2015,American lawyer,"Milton, DE",Male,1959-11-14,61,"Bryan Stevenson is an American lawyer, social justice activist, founder/executive director of the Equal Justice Initiative, and a law professor at New York University School of Law. ",https://time.com/collection-post/3823265/bryan-stevenson-2015-time-100/,USA
422,Chai Jing,PIONEERS,2015,Chinese journalist,"Linfen, China",Female,1976-01-01,44,"Chai Jing is a Chinese journalist, former television host, author and environmental activist. In 1995, Chai began her broadcast career as a radio host in Hunan Province. From 2001 to 2013, she worked for China Central Television as a well respected investigative reporter and host. ",https://time.com/collection-post/3823269/chai-jing-2015-time-100/,China
423,Magnus MacFarlane-Barrow,PIONEERS,2015,Null,"Aberdeen, United Kingdom",Male,1905-05-21,52,Null,https://time.com/collection-post/3823271/magnus-macfarlane-barrow-2015-time-100/,United Kingdom
424,Kira Orange Jones,PIONEERS,2015,Null,,Female,,0,Null,https://time.com/collection-post/3822936/kira-orange-jones-2015-time-100/,Null
425,Aura Elena Farfán,PIONEERS,2015,Guatemalan human rights activists,"Guatemala City, Guatemala",Female,1940-02-02,80,"Aura Elena Farfán is a Guatemalan human rights activist. She is one of the founders and Executive Director of FAMDEGUA, a Guatemala City-based organization dedicated to surviving family members of people who have been disappeared by the Guatemalan government. It is one of Guatemala's oldest human rights organizations. ",https://time.com/collection-post/3822942/aura-elena-farfan-2015-time-100/,Guatemala
426,Martin Blaser,PIONEERS,2015,Professor,"Rutgers, NJ",Male,,0,Martin J. Blaser is the director of the Center for Advanced Biotechnology and Medicine at Rutgers Biomedical and Health Sciences and the Henry Rutgers Chair of the Human Microbiome and professor of medicine and microbiology at the Rutgers Robert Wood Johnson Medical School in New Jersey. ,https://time.com/collection-post/3822950/martin-blaser-2015-time-100/,USA
427,Anita Sarkeesian,PIONEERS,2015,American-Canadian critic,"Ontario, Canada",Female,1905-06-05,37,"Anita Sarkeesian is a Canadian-American feminist media critic and public speaker. She is the founder of Feminist Frequency, a website that hosts videos and commentary analyzing portrayals of women in popular culture. ",https://time.com/collection-post/3822727/anita-sarkeesian-2015-time-100/,Canada
428,Tom Catena,PIONEERS,2015,American physician,"Amsterdam, NY",Male,1964-04-27,56,Thomas Catena is an American physician who has been practising in Gidel in the Nuba Mountains of Sudan since 2008. ,https://time.com/collection-post/3823233/tom-catena-2015-time-100/,USA
429,Rudolph Tanzi,PIONEERS,2015,Professor,"Providence, RI",Male,1905-05-11,62,"Rudolph Tanzi is the Joseph P. and Rose F. Kennedy Professor of Neurology at Harvard University, and Vice-Chair of Neurology, Director of the Genetics and Aging Research Unit, and Co-Director of the Henry and Allison McCance Center for Brain Health at Massachusetts General Hospital. ",https://time.com/collection-post/3823236/rudolph-tanzi-2015-time-100/,USA
430,Mustafa Hassan,PIONEERS,2015,Null,,Male,,0,Null,https://time.com/collection-post/3822966/mustafa-hassan-2015-time-100/,Null
431,Laverne Cox,PIONEERS,2015,American actress,"Mobile, AL",Female,1972-05-29,48,"Laverne Cox is an American actress and LGBTQ+ advocate. She rose to prominence with her role as Sophia Burset on the Netflix series Orange Is the New Black, becoming the first openly transgender person ... ",https://time.com/collection-post/3822970/laverne-cox-2015-time-100/,USA
432,Sarah Koenig,PIONEERS,2015,American journalist,"Sagaponack, NY",Unknown,1969-07-01,51,"Sarah Koenig is an American journalist, public radio personality, former producer of the television and radio program This American Life, and the host and executive producer of the podcast Serial. ",https://time.com/collection-post/3823276/sarah-koenig-2015-time-100/,USA
433,Bradley Cooper,PIONEERS,2015,American actor,"Philadelphia, PA",Male,1975-01-05,45,"Bradley Charles Cooper is an American actor and filmmaker. He has been nominated for many awards, including eight Academy Awards and a Tony Award, and has won two Grammy Awards and a BAFTA Award. ",https://time.com/collection-post/3822978/bradley-cooper-2015-time-100/,USA
434,Richard Linklater,ARTISTS,2015,American film director,"Houston, TX",Male,1960-07-30,60,"Richard Stuart Linklater is an American film director, producer, and screenwriter. He is known for films that revolve mainly around suburban culture and the effects of the passage of time. ",https://time.com/collection-post/3822985/richard-linklater-2015-time-100/,USA
435,Chris Ofili,ARTISTS,2015,British painter,"Manchester, United Kingdom",Male,1968-10-10,52,"Christopher Ofili, CBE is a British Turner Prize-winning painter who is best known for his paintings incorporating elephant dung. He was one of the Young British Artists. Since 2005, Ofili has been living and working in Trinidad and Tobago, where he currently resides in Port of Spain. ",https://time.com/collection-post/3822991/chris-ofili-2015-time-100/,United Kingdom
436,Julianna Margulies,ARTISTS,2015,American actress,"Spring Valley, NY",Female,1966-06-08,54,"Julianna Margulies is an American actress and producer. After several small television roles, Margulies achieved wide recognition for her starring role as Carol Hathaway on NBC's long-running medical drama series ER, for which she received a Primetime Emmy Award. ",https://time.com/collection-post/3822964/julianna-margulies-2015-time-100/,USA
437,Amy Schumer,ARTISTS,2015,American stand-up comedian,"Upper East Side, New York, NY",Female,1981-06-01,39,Amy Beth Schumer is an American stand-up comedian and actress. She ventured into comedy in the early 2000s before appearing as a contestant on the fifth season of the NBC reality competition series Last Comic Standing in 2007. ,https://time.com/collection-post/3823137/amy-schumer-2015-time-100/,USA
438,Alexander Wang,ARTISTS,2015,American fashion designer,"San Francisco, CA",Male,1983-12-26,36,"Alexander Wang is an American fashion designer. Wang began his Alexander Wang fashion brand in 2005 and came to prominence after being awarded the CFDA/Vogue Fashion Fund in 2008. From November 2012 through July 2015, Wang was Creative Director at Balenciaga. ",https://time.com/collection-post/3823143/alexander-wang-2015-time-100/,USA
439,Jill Soloway,ARTISTS,2015,American television director,"Chicago, IL",Female,1965-09-26,55,"Joey Soloway is an American television creator, showrunner, director and writer. Soloway is known for creating, writing, executive producing and directing the Amazon original series Transparent, winning ... ",https://time.com/collection-post/3822910/jill-soloway-2015-time-100/,USA
