,Name,Category,Year,Link,Name_right,Profession,Birth Info,Description,Birthplace,Birthdate,Age,Pronouns
0,Luiz Inácio Lula da Silva ,LEADERS,2010,"www.content.time.com/time/specials/packages/article/0,28804,1984685_1984864_1984866,00.html",Null,Null,"Born: October 27, 1945 (age 75 years), Caetés, State of Pernambuco, Brazil","Luiz Inácio Lula da Silva, known as Lula, is a Brazilian politician and former union leader who served as the 35th President of Brazil from 1 January 2003 to 31 December 2010. ","Caetés, State of Pernambuco, Brazil","October 27, 1945",75,
1,J.T. Wang ,LEADERS,2010,"www.content.time.com/time/specials/packages/article/0,28804,1984685_1984864_1985425,00.html",Null,Null,Born: July 1954 (age 66 years),Null,,July 1954,66,
2,Admiral Mike Mullen ,LEADERS,2010,"www.content.time.com/time/specials/packages/article/0,28804,1984685_1984864_1985426,00.html",Null,Null,"Born: October 4, 1946 (age 74 years), Los Angeles County, CA","Michael Glenn Mullen is a retired United States Navy admiral, who served as the 17th Chairman of the Joint Chiefs of Staff from October 1, 2007, to September 30, 2011. Mullen previously served as the Navy's 28th Chief of Naval Operations from July 22, 2005, to September 29, 2007. ","Los Angeles County, CA","October 4, 1946",74,
3,Barack Obama ,LEADERS,2010,"www.content.time.com/time/specials/packages/article/0,28804,1984685_1984864_1985427,00.html",Null,Null,"Born: August 4, 1961 (age 59 years), Kapiʻolani Medical Center for Women & Children, Honolulu, HI","Barack Hussein Obama II is an American politician and attorney who served as the 44th president of the United States from 2009 to 2017. A member of the Democratic Party, Obama was the first African-American president of the United States. ","Kapiʻolani Medical Center for Women & Children, Honolulu, HI","August 4, 1961",59,
4,Ron Bloom ,LEADERS,2010,"www.content.time.com/time/specials/packages/article/0,28804,1984685_1984864_1985429,00.html",Null,Null,"Born: 1956 (age 64 years), New York, NY",Ron Bloom was a senior official in the Obama Administration from February 2009 to August 2011. This included working as the Assistant to the President for Manufacturing Policy between February 2011 and ... ,"New York, NY",1956,64,
5,Yukio Hatoyama ,LEADERS,2010,"www.content.time.com/time/specials/packages/article/0,28804,1984685_1984864_1985436,00.html",Null,Null,"Born: February 11, 1947 (age 73 years), Bunkyo City, Tokyo, Japan",Yukio Hatoyama is a former Japanese politician who served as Prime Minister of Japan from 16 September 2009 to 8 June 2010. He was the first Prime Minister from the modern Democratic Party of Japan. ,"Bunkyo City, Tokyo, Japan","February 11, 1947",73,He
6,Dominique Strauss-Kahn ,LEADERS,2010,"www.content.time.com/time/specials/packages/article/0,28804,1984685_1984864_1985437,00.html",Null,Null,"Born: April 25, 1949 (age 71 years), Neuilly-sur-Seine, France","Dominique Gaston André Strauss-Kahn is a French economist, politician, former managing director of the International Monetary Fund, and a controversial figure in the French Socialist Party due to his involvement in several financial and sexual scandals. ","Neuilly-sur-Seine, France","April 25, 1949",71,his
7,Nancy Pelosi ,LEADERS,2010,"www.content.time.com/time/specials/packages/article/0,28804,1984685_1984864_1985438,00.html",Null,Null,"Born: March 26, 1940 (age 80 years), Baltimore, MD","Nancy Patricia Pelosi is an American politician serving as Speaker of the United States House of Representatives since 2019, and previously from 2007 to 2011. Pelosi has served as a U.S. representative from California since 1987. ","Baltimore, MD","March 26, 1940",80,
8,Sarah Palin ,LEADERS,2010,"www.content.time.com/time/specials/packages/article/0,28804,1984685_1984864_1984871,00.html",Null,Null,"Born: February 11, 1964 (age 56 years), Sandpoint, ID","Sarah Louise Palin is an American retired politician, commentator, author, and reality television personality, who served as the ninth governor of Alaska from 2006 until her resignation in 2009. ","Sandpoint, ID","February 11, 1964",56,her
9,Salam Fayyad ,LEADERS,2010,"www.content.time.com/time/specials/packages/article/0,28804,1984685_1984864_1984897,00.html",Null,Null,"Born: April 12, 1952 (age 68 years), Deir al-Ghusun",Salam Fayyad is a Jordanian-Palestinian politician and former Prime Minister of the Palestinian Authority and Finance Minister. He was Finance Minister from June 2002 to November 2005 and from March 2007 to May 2012. Fayyad was Prime Minister between June 2007 and June 2013. ,Deir al-Ghusun,"April 12, 1952",68,He
10,Jon Kyl ,LEADERS,2010,"www.content.time.com/time/specials/packages/article/0,28804,1984685_1984864_1984901,00.html",Null,Null,"Born: April 25, 1942 (age 78 years), Oakland, NE","Jon Llewellyn Kyl is an American politician who served as a United States Senator for Arizona from 1995 to 2013 and again in 2018. A Republican, he held both of Arizona's Senate seats at different times, serving alongside John McCain during his first stint. Kyl was Senate Minority Whip from 2007 until 2013. ","Oakland, NE","April 25, 1942",78,he
11,Glenn Beck ,LEADERS,2010,"www.content.time.com/time/specials/packages/article/0,28804,1984685_1984864_1985415,00.html",Null,Null,"Born: February 10, 1964 (age 56 years), Everett, WA","Glenn Lee Beck is an American conservative political commentator, radio host, television producer. He is the CEO, founder, and owner of Mercury Radio Arts, the parent company of his television and radio network TheBlaze. ","Everett, WA","February 10, 1964",56,He
12,Annise Parker ,LEADERS,2010,"www.content.time.com/time/specials/packages/article/0,28804,1984685_1984864_1985414,00.html",Null,Null,"Born: May 17, 1956 (age 64 years), Houston, TX","Annise Danette Parker is an American politician who served as the 61st Mayor of Houston, Texas, from 2010 until 2016. She also served as an at-large member of the Houston City Council from 1998 to 2003 and city controller from 2004 to 2010. ","Houston, TX","May 17, 1956",64,She
13,Tidjane Thiam ,LEADERS,2010,"www.content.time.com/time/specials/packages/article/0,28804,1984685_1984864_1985413,00.html",Null,Null,"Born: July 29, 1962 (age 58 years), Côte d'Ivoire","Tidjane Thiam is an Ivorian banker who was the chief executive officer of Swiss bank Credit Suisse from March 2015 to February 2020. He was the chief financial officer of British banking group Prudential from 2007 to 2009, and then its CEO until 2013. ",Côte d'Ivoire,"July 29, 1962",58,He
14,Jenny Beth Martin ,LEADERS,2010,"www.content.time.com/time/specials/packages/article/0,28804,1984685_1984864_1985462,00.html",Null,Null,"Born: July 2, 1970 (age 50 years), Georgia","Jenny Beth Martin is the co-founder and national coordinator of the Tea Party Patriots, and a columnist for The Washington Times. In February 2010, Martin was named to TIME Magazine's 100 Most Influential Leaders. She is the co-author of Tea Party Patriots: The Second American Revolution. ",Georgia,"July 2, 1970",50,She
15,Christine Lagarde ,LEADERS,2010,"www.content.time.com/time/specials/packages/article/0,28804,1984685_1984864_1985463,00.html",Null,Null,"Born: January 1, 1956 (age 64 years), 9th arrondissement of Paris, Paris, France","Christine Madeleine Odette Lagarde is a French politician, businessperson and lawyer serving as President of the European Central Bank since 1st November 2019. Between July 2011 and September 2019, she served as Chair and Managing Director of the International Monetary Fund. ","9th arrondissement of Paris, Paris, France","January 1, 1956",64,she
16,Recep Tayyip Erdogan ,LEADERS,2010,"www.content.time.com/time/specials/packages/article/0,28804,1984685_1984864_1985464,00.html",Null,Null,"Born: February 26, 1954 (age 66 years), Kasımpaşa, Beyoğlu, Turkey",Recep Tayyip Erdoğan is a Turkish politician serving as the current President of Turkey. He previously served as Prime Minister of Turkey from 2003 to 2014 and as Mayor of Istanbul from 1994 to 1998. ,"Kasımpaşa, Beyoğlu, Turkey","February 26, 1954",66,He
17,General Stanley McChrystal ,LEADERS,2010,"www.content.time.com/time/specials/packages/article/0,28804,1984685_1984864_1984880,00.html",Null,Null,"Born: August 14, 1954 (age 66 years), Fort Leavenworth","Stanley Allen McChrystal is a retired United States Army general best known for his command of Joint Special Operations Command in the mid-2000s. His last assignment was as Commander, International Security Assistance Force and Commander, United States Forces – Afghanistan. ",Fort Leavenworth,"August 14, 1954",66,his
18,Manmohan Singh ,LEADERS,2010,"www.content.time.com/time/specials/packages/article/0,28804,1984685_1984864_1984890,00.html",Null,Null,"Born: September 26, 1932 (age 88 years), Gah, Pakistan","Manmohan Singh is an Indian economist, academic, and politician who served as the 13th Prime Minister of India from 2004 to 2014. The first Sikh in office, Singh was also the first prime minister since Jawaharlal Nehru to be re-elected after completing a full five-year term. ","Gah, Pakistan","September 26, 1932",88,
19,Bo Xilai ,LEADERS,2010,"www.content.time.com/time/specials/packages/article/0,28804,1984685_1984864_1985416,00.html",Null,Null,"Born: July 3, 1949 (age 71 years), Beiping","Bo Xilai is a former Chinese politician who was convicted on bribery and embezzlement charges. He came to prominence through his tenures as Mayor of Dalian and then the governor of Liaoning. From 2004 to November 2007, he served as Minister of Commerce. ",Beiping,"July 3, 1949",71,He
20,Mark Carney ,LEADERS,2010,"www.content.time.com/time/specials/packages/article/0,28804,1984685_1984864_1985417,00.html",Null,Null,"Born: March 16, 1965 (age 55 years), Fort Smith, Canada","Mark Joseph Carney OC is an economist and banker who served as the Governor of the Bank of Canada from 2008 until 2013 and the Governor of the Bank of England from 2013 to 2020. He holds Canadian, British and Irish citizenship and was Chairman of the Financial Stability Board from 2011 to 2018. ","Fort Smith, Canada","March 16, 1965",55,He
21,Sister Carol Keehan ,LEADERS,2010,"www.content.time.com/time/specials/packages/article/0,28804,1984685_1984864_1985418,00.html",Null,Null,"Born: Capitol Hill, Washington, D.C.","Sister Carol Keehan, D.C. is a member of the Daughters of Charity of Saint Vincent de Paul and the CEO of the Catholic Health Association of the United States. ",,"Capitol Hill, Washington,",,
22,Sheik Khalifa bin Zayed al-Nahyan ,LEADERS,2010,"www.content.time.com/time/specials/packages/article/0,28804,1984685_1984864_1985435,00.html",Null,Null,"Born: September 7, 1948 (age 72 years), Qasr Al Muwaiji, Al Ain, United Arab Emirates","Khalifa bin Zayed bin Sultan Al Nahyan is the current president of the United Arab Emirates, the emir of Abu Dhabi, the supreme commander of the United Arab Emirates Armed Forces and the chairman of the Supreme Petroleum Council. ","Qasr Al Muwaiji, Al Ain, United Arab Emirates","September 7, 1948",72,
23,Robin Li ,LEADERS,2010,"www.content.time.com/time/specials/packages/article/0,28804,1984685_1984864_1985434,00.html",Null,Null,"Born: November 17, 1968 (age 52 years), Yangquan, China","Robin Li Yanhong is a Chinese software engineer and billionaire internet entrepreneur. He is the co-founder of the search engine Baidu, and one of the richest people in China, with a net worth of US$6.0 billion as of May 2020. ","Yangquan, China","November 17, 1968",52,He
24,Scott Brown ,LEADERS,2010,"www.content.time.com/time/specials/packages/article/0,28804,1984685_1984864_1984895,00.html",Null,Null,"Born: September 12, 1959 (age 61 years), Kittery, ME","Scott Philip Brown is an American diplomat, attorney, and politician serving as the United States Ambassador to New Zealand and Samoa. He is a former United States Senator for Massachusetts, and also was the 2014 Republican nominee for the U.S. Senate in New Hampshire. ","Kittery, ME","September 12, 1959",61,He
25,Bill Clinton ,ICONS,2010,"www.content.time.com/time/specials/packages/article/0,28804,1984685_1984949_1984950,00.html",Null,Null,"Born: August 19, 1946 (age 74 years), Hope, AR","William Jefferson Clinton is an American politician and attorney who served as the 42nd president of the United States from 1993 to 2001. Prior to his presidency, he served as governor of Arkansas and as attorney general of Arkansas. ","Hope, AR","August 19, 1946",74,his
26,Kim Yu-Na ,ICONS,2010,"www.content.time.com/time/specials/packages/article/0,28804,1984685_1984949_1985220,00.html",Null,Null,"Born: September 5, 1990 (age 30 years), Bucheon-si, South Korea","Yuna Kim, also credited in eastern name order as Kim Yuna or Kim Yeon-ah, is a retired South Korean competitive figure skater. ","Bucheon-si, South Korea","September 5, 1990",30,
27,Mir-Hossein Mousavi ,ICONS,2010,"www.content.time.com/time/specials/packages/article/0,28804,1984685_1984949_1985221,00.html",Null,Null,"Born: September 29, 1941 (age 79 years), Khamaneh, Iran","Mir-Hossein Mousavi Khameneh is an Iranian reformist politician, artist and architect who served as the seventy-ninth and last Prime Minister of Iran from 1981 to 1989. He was a reformist candidate for the 2009 presidential election and eventually the leader of the opposition in the post-election unrest. ","Khamaneh, Iran","September 29, 1941",79,He
28,Ben Stiller ,ICONS,2010,"www.content.time.com/time/specials/packages/article/0,28804,1984685_1984949_1985239,00.html",Null,Null,"Born: November 30, 1965 (age 55 years), New York, NY","Benjamin Edward Meara Stiller is an American actor, comedian, film producer, film director, and writer. He is the son of the late comedians and actors Jerry Stiller and Anne Meara. ","New York, NY","November 30, 1965",55,He
29,Temple Grandin ,ICONS,2010,"www.content.time.com/time/specials/packages/article/0,28804,1984685_1984949_1985222,00.html",Null,Null,"Born: August 29, 1947 (age 73 years), Boston, MA","Mary Temple Grandin is a prominent proponent for the humane treatment of livestock for slaughter and author of more than 60 scientific papers on animal behavior. She is a consultant to the livestock industry on animal behavior, and an autism spokesperson. ","Boston, MA","August 29, 1947",73,She
30,P. Namperumalsamy ,ICONS,2010,"www.content.time.com/time/specials/packages/article/0,28804,1984685_1984949_1985223,00.html",Null,Null,"Born: January 11, 1939 (age 81 years), Ambasamudram, India","Perumalsamy Namperumalsamy is an Indian ophthalmologist who specializes in diabetic retinopathy. He is also a retina-vitreous expert. Namperumalsamy is currently the chairman Emeritus of Aravind Eye Hospital, Madurai. He is known for bringing assembly-line efficiency to eye surgery. ","Ambasamudram, India","January 11, 1939",81,He
31,Nay Phone Latt ,ICONS,2010,"www.content.time.com/time/specials/packages/article/0,28804,1984685_1984949_1985235,00.html",Null,Null,"Born: June 28, 1980 (age 40 years), Yangon, Myanmar (Burma)","Nay Phone Latt is a Burmese blogger and activist, currently serving as a Yangon Region Hluttaw MP for Thingangyun Township. He was a recipient of PEN/Barbara Goldsmith Freedom to Write Award and selected for 2010 Time 100 list under Hero Categories. ","Yangon, Myanmar (Burma)","June 28, 1980",40,He
32,Chen Shu-chu ,ICONS,2010,"www.content.time.com/time/specials/packages/article/0,28804,1984685_1984949_1985237,00.html",Null,Null,"Born: 1951 (age 69 years), Taitung County, Taiwan","Chen Shu-chu is a vegetable vendor and philanthropist from Taitung County, Taiwan. She gives generously with her modest incomes. She said ""Money serves its purpose only when it is used for those who need it and always be happy when she helped others."" ","Taitung County, Taiwan",1951,69,She
33,Phil Mickelson ,ICONS,2010,"www.content.time.com/time/specials/packages/article/0,28804,1984685_1984949_1985236,00.html",Null,Null,"Born: June 16, 1970 (age 50 years), San Diego, CA","Philip Alfred Mickelson, nicknamed Lefty, is an American professional golfer. He has won 44 events on the PGA Tour, including five major championships: three Masters titles, a PGA Championship, and an Open Championship. Mickelson is one of 12 players in the history of golf to win three of the four majors. ","San Diego, CA","June 16, 1970",50,He
34,Didier Drogba ,ICONS,2010,"www.content.time.com/time/specials/packages/article/0,28804,1984685_1984949_1985240,00.html",Null,Null,"Born: March 11, 1978 (age 42 years), Abidjan, Côte d’Ivoire",Didier Yves Drogba Tébily is an Ivorian retired professional footballer who played as a striker. He is the all-time top scorer and former captain of the Ivory Coast national team. ,"Abidjan, Côte d’Ivoire","March 11, 1978",42,He
35,Graça Machel ,ICONS,2010,"www.content.time.com/time/specials/packages/article/0,28804,1984685_1984949_1985241,00.html",Null,Null,"Born: October 17, 1945 (age 75 years), Gaza Province, Mozambique",Graça Machel DBE HonFBA is a Mozambican politician and humanitarian. She is the widow of both former presidents of Mozambique and South Africa; Mozambican president Samora Machel and South African president Nelson Mandela. ,"Gaza Province, Mozambique","October 17, 1945",75,She
36,Reem Al Numery ,ICONS,2010,"www.content.time.com/time/specials/packages/article/0,28804,1984685_1984949_1985230,00.html",Null,Null,"Born: 1996 (age 24 years), Yemen","Reem Al Numery is a children's rights activist in Yemen. Known for resisting child marriage, she was honored by U.S. Secretary of State Hillary Clinton on March 11, 2009, with the International Women of Courage Award. She was listed in the Time Magazine 2010 100 Most Influential People in the World. ",Yemen,1996,24,she
37,Sachin Tendulkar ,ICONS,2010,"www.content.time.com/time/specials/packages/article/0,28804,1984685_1984949_1985228,00.html",Null,Null,"Born: April 24, 1973 (age 47 years), Mumbai, India",Sachin Ramesh Tendulkar is an Indian former international cricketer who served as captain of the Indian national team. He is widely regarded as the greatest batsmen in the history of cricket. He is the highest run scorer of all time in International cricket. ,"Mumbai, India","April 24, 1973",47,He
38,Tristan Lecomte ,ICONS,2010,"www.content.time.com/time/specials/packages/article/0,28804,1984685_1984949_1985225,00.html",Null,Null,"Born: 1973 (age 47 years), Reims, France",Null,"Reims, France",1973,47,
39,Liya Kebede ,ICONS,2010,"www.content.time.com/time/specials/packages/article/0,28804,1984685_1984949_1985231,00.html",Null,Null,"Born: March 1, 1978 (age 42 years), Addis Ababa, Ethiopia","Liya Kebede is an Ethiopian-born model, maternal health advocate, clothing designer, and actress. She has appeared on the cover of Vogue three times. Kebede has served as the WHO's Ambassador for Maternal, Newborn and Child Health since 2005. ","Addis Ababa, Ethiopia","March 1, 1978",42,She
40,Kiran Mazumdar-Shaw ,ICONS,2010,"www.content.time.com/time/specials/packages/article/0,28804,1984685_1984949_1985233,00.html",Null,Null,"Born: March 23, 1953 (age 67 years), Pune, India","Kiran Mazumdar-Shaw is an Indian billionaire entrepreneur. She is the chairperson and managing director of Biocon Limited, a biotechnology company based in Bangalore, India and the former chairperson of Indian Institute of Management, Bangalore. ","Pune, India","March 23, 1953",67,She
41,Zahra Rahnavard ,ICONS,2010,"www.content.time.com/time/specials/packages/article/0,28804,1984685_1984949_1985245,00.html",Null,Null,"Born: August 19, 1945 (age 75 years), Borujerd, Iran","Zahra Rahnavard is an Iranian academic, artist and politician. Rahnavard is a university professor, artist, and crusading intellectual who had been under house arrest from February 2011 to May 2018. In 2009, Foreign Policy magazine named her one of the world’s most distinguished thinkers. ","Borujerd, Iran","August 19, 1945",75,her
42,Jet Li ,ICONS,2010,"www.content.time.com/time/specials/packages/article/0,28804,1984685_1984949_1985246,00.html",Null,Null,"Born: April 26, 1963 (age 57 years), Beijing, China","Li Lianjie, better known by his stage name Jet Li, is a Chinese-Singaporean film actor, film producer, martial artist, and retired Wushu champion who was born in Beijing. After three years of training with acclaimed Wushu teacher Wu Bin, Li won his first national championship for the Beijing Wushu Team. ","Beijing, China","April 26, 1963",57,his
43,Serena Williams ,ICONS,2010,"www.content.time.com/time/specials/packages/article/0,28804,1984685_1984949_1985247,00.html",Null,Null,"Born: September 26, 1981 (age 39 years), Saginaw, MI","Serena Jameka Williams is an American professional tennis player and former world No. 1 in women's single tennis. She has won 23 Grand Slam singles titles, the most by any player in the Open Era, and the second-most of all time behind Margaret Court. ","Saginaw, MI","September 26, 1981",39,She
44,Chief Master Sergeant Tony Travis ,ICONS,2010,"www.content.time.com/time/specials/packages/article/0,28804,1984685_1984949_1985270,00.html",Null,Null,Null,Null,,,,
45,Karls Paul-Noel ,ICONS,2010,"www.content.time.com/time/specials/packages/article/0,28804,1984685_1984949_1985274,00.html",Null,Null,Null,Null,,,,
46,Rahul Singh ,ICONS,2010,"www.content.time.com/time/specials/packages/article/0,28804,1984685_1984949_1985267,00.html",Null,Null,"Born: October 18, 1976 (age 44 years), Udaipur, India",Rahul Singh is an actor known for his works in Bollywood. Singh's mother Prabha Thakur is a Hindi poet and also a member of Rajya Sabha. ,"Udaipur, India","October 18, 1976",44,his
47,Valentin Abe ,ICONS,2010,"www.content.time.com/time/specials/packages/article/0,28804,1984685_1984949_1985272,00.html",Null,Null,Born: Côte d'Ivoire,Null,,Côte,,
48,Malalai Joya ,ICONS,2010,"www.content.time.com/time/specials/packages/article/0,28804,1984685_1984949_1985238,00.html",Null,Null,"Born: April 25, 1978 (age 42 years), Farah, Afghanistan","Malalai Joya is an activist, writer, and a former politician from Afghanistan. She served as a Parliamentarian in the National Assembly of Afghanistan from 2005 until early 2007, after being dismissed for publicly denouncing the presence of warlords and war criminals in the Afghan Parliament. ","Farah, Afghanistan","April 25, 1978",42,She
49,Will Allen ,ICONS,2010,"www.content.time.com/time/specials/packages/article/0,28804,1984685_1984949_1985243,00.html",Null,Null,"Born: February 8, 1949 (age 71 years), Rockville, MD",Will Allen is an American urban farmer based in Milwaukee and a retired professional basketball player. ,"Rockville, MD","February 8, 1949",71,
50,Lady Gaga ,ARTISTS,2010,"www.content.time.com/time/specials/packages/article/0,28804,1984685_1984940_1984943,00.html",Null,Null,"Born: March 28, 1986 (age 34 years), Lenox Hill Hospital, New York, NY","Stefani Joanne Angelina Germanotta, known professionally as Lady Gaga, is an American singer, songwriter, record producer, actress and businesswoman. She is known for her consistent image reinventions and versatility in both music and entertainment. ","Lenox Hill Hospital, New York, NY","March 28, 1986",34,She
51,Conan O'Brien ,ARTISTS,2010,"www.content.time.com/time/specials/packages/article/0,28804,1984685_1984940_1985538,00.html",Null,Null,"Born: April 18, 1963 (age 57 years), Brookline, MA","Conan Christopher O'Brien is an American television host, comedian, writer, podcaster, and producer. He is best known for hosting the late-night talk shows Late Night with Conan O'Brien, The Tonight Show with Conan O'Brien, and since 2010, Conan on the cable channel TBS. ","Brookline, MA","April 18, 1963",57,He
52,Kathryn Bigelow ,ARTISTS,2010,"www.content.time.com/time/specials/packages/article/0,28804,1984685_1984940_1985539,00.html",Null,Null,"Born: November 27, 1951 (age 69 years), San Carlos, CA","Kathryn Ann Bigelow is an American film director, producer, and screenwriter. Covering a wide range of genres, her films include Near Dark, Point Break, Strange Days, K-19: The Widowmaker, The Hurt Locker, Zero Dark Thirty, and Detroit. ","San Carlos, CA","November 27, 1951",69,her
53,Oprah Winfrey ,ARTISTS,2010,"www.content.time.com/time/specials/packages/article/0,28804,1984685_1984940_1985540,00.html",Null,Null,"Born: January 29, 1954 (age 66 years), Kosciusko, MS","Oprah Gail Winfrey is an American talk show host, television producer, actress, author, and philanthropist. ","Kosciusko, MS","January 29, 1954",66,
54,Valery Gergiev ,ARTISTS,2010,"www.content.time.com/time/specials/packages/article/0,28804,1984685_1984940_1984947,00.html",Null,Null,"Born: May 2, 1953 (age 67 years), Moscow, Russia","Valery Abisalovich Gergiev is a Russian conductor and opera company director of Ossetian origin. He is general director and artistic director of the Mariinsky Theatre, chief conductor of the Munich Philharmonic and artistic director of the White Nights Festival in St. Petersburg. ","Moscow, Russia","May 2, 1953",67,He
55,Robert Pattinson ,ARTISTS,2010,"www.content.time.com/time/specials/packages/article/0,28804,1984685_1984940_1984948,00.html",Null,Null,"Born: May 13, 1986 (age 34 years), London, United Kingdom","Robert Douglas Thomas Pattinson is an English actor. After starting to act in a London theatre club at the age of 15, he began his film career by playing Cedric Diggory in the fantasy film Harry Potter and the Goblet of Fire. ","London, United Kingdom","May 13, 1986",34,he
